{
  "id": 1,
  "userId": "string",
  "provider": "string",
  "principal": "string",
  "name": {
    "email": "string"
  },
  "splitScopes": [
    "string"
  ],
  "scopes": "string",
  "avatar": "string",
  "userInfo": {
    "sub": "string",
    "email": "string",
    "email_verified": false,
    "name": "string",
    "given_name": "string",
    "family_name": "string",
    "picture": "string",
    "locale": "string",
    "hd": "string",
    "oid": "string"
  }
}